{
  "$schema": "http://json-schema.org/draft-07/schema#",
  "type": "object",
  "properties": {
    "$schema": {
      "type": "string"
    },
    "ocr": {
      "description": "How text is extracted.",
      "default": {},
      "type": "object",
      "properties": {
        "engine": {
          "default": "auto",
          "description": "\"auto\" (local PP-OCR when its models are downloaded, else Mistral if MISTRAL_API_KEY is set, else models.vision, else text layer), \"text-layer\", \"pp-ocr\" (local PP-OCRv5 on onnxruntime-node; downloads 13 MB once), \"mistral\", or a vision model such as \"ollama/gemma4:e4b-it-qat\".",
          "type": "string"
        },
        "pages": {
          "default": "auto",
          "description": "PDF pages sent to the OCR engine. \"auto\": all pages for Mistral, scanned pages for local and vision models.",
          "type": "string",
          "enum": [
            "auto",
            "all",
            "scanned"
          ]
        },
        "concurrency": {
          "description": "Parallel page requests (default: the provider's concurrency).",
          "type": "integer",
          "minimum": 1,
          "maximum": 32
        },
        "stripImages": {
          "default": true,
          "description": "Remove image placeholders such as ![img-0.jpeg](img-0.jpeg).",
          "type": "boolean"
        },
        "removeHeaderFooter": {
          "default": true,
          "description": "Remove running headers, footers and page numbers that repeat across pages.",
          "type": "boolean"
        },
        "minTextChars": {
          "default": 40,
          "description": "A PDF page with fewer extractable characters is treated as scanned.",
          "type": "integer",
          "minimum": 0,
          "maximum": 9007199254740991
        }
      },
      "additionalProperties": false
    },
    "models": {
      "description": "Models per stage as \"provider/model\". A stage without a model is skipped.",
      "default": {},
      "type": "object",
      "properties": {
        "vision": {
          "description": "Vision model for scanned pages and images, e.g. \"ollama/gemma4:e4b-it-qat\".",
          "type": "string",
          "pattern": "^[a-z0-9][a-z0-9_-]*\\/\\S.*$"
        },
        "structure": {
          "description": "LLM that repairs heading levels. Skipped when unset.",
          "type": "string",
          "pattern": "^[a-z0-9][a-z0-9_-]*\\/\\S.*$"
        },
        "context": {
          "description": "LLM that writes contextual-retrieval summaries. Skipped when unset.",
          "type": "string",
          "pattern": "^[a-z0-9][a-z0-9_-]*\\/\\S.*$"
        },
        "embedding": {
          "description": "Embedding model, e.g. \"ollama/embeddinggemma\". Skipped when unset.",
          "type": "string",
          "pattern": "^[a-z0-9][a-z0-9_-]*\\/\\S.*$"
        }
      },
      "additionalProperties": false
    },
    "providers": {
      "default": {},
      "description": "Provider settings and custom OpenAI-compatible endpoints, keyed by the name used in model references.",
      "type": "object",
      "propertyNames": {
        "type": "string",
        "pattern": "^[a-z0-9][a-z0-9_-]*$"
      },
      "additionalProperties": {
        "type": "object",
        "properties": {
          "type": {
            "description": "Adapter to use. Optional for built-in names (openai, openrouter, anthropic, gemini, ollama, mistral, lmstudio).",
            "type": "string",
            "enum": [
              "openai",
              "openai-compatible",
              "openrouter",
              "anthropic",
              "gemini",
              "ollama",
              "mistral",
              "cohere",
              "jina"
            ]
          },
          "baseURL": {
            "description": "API base URL (proxies, LM Studio, vLLM, self-hosted gateways).",
            "type": "string",
            "format": "uri"
          },
          "apiKey": {
            "description": "Programmatic use only. Config files must not contain keys — use environment variables.",
            "type": "string",
            "minLength": 1
          },
          "apiKeyEnv": {
            "description": "Environment variable holding the key (default: the provider's standard one).",
            "type": "string",
            "minLength": 1
          },
          "headers": {
            "description": "Extra HTTP headers sent with every request.",
            "type": "object",
            "propertyNames": {
              "type": "string"
            },
            "additionalProperties": {
              "type": "string"
            }
          },
          "contextWindow": {
            "description": "Context window in tokens, for providers that cannot report it.",
            "type": "integer",
            "exclusiveMinimum": 0,
            "maximum": 9007199254740991
          },
          "maxContext": {
            "description": "Upper bound for Ollama's num_ctx; keeps memory use predictable. Default 32768.",
            "type": "integer",
            "minimum": 2048,
            "maximum": 9007199254740991
          },
          "concurrency": {
            "description": "Maximum parallel requests to this provider.",
            "type": "integer",
            "minimum": 1,
            "maximum": 64
          },
          "timeoutMs": {
            "description": "Per-request timeout in milliseconds.",
            "type": "integer",
            "exclusiveMinimum": 0,
            "maximum": 9007199254740991
          },
          "maxRetries": {
            "description": "Retries for transient errors (429, 5xx, network). Default 4.",
            "type": "integer",
            "minimum": 0,
            "maximum": 10
          }
        },
        "additionalProperties": false
      }
    },
    "chunk": {
      "description": "Chunk sizes and boundaries.",
      "default": {},
      "type": "object",
      "properties": {
        "maxTokens": {
          "default": 512,
          "description": "Maximum tokens per chunk.",
          "type": "integer",
          "minimum": 32,
          "maximum": 16384
        },
        "minTokens": {
          "default": 64,
          "description": "Smaller chunks are merged with a neighbour in the same section.",
          "type": "integer",
          "minimum": 0,
          "maximum": 9007199254740991
        },
        "overlapTokens": {
          "default": 0,
          "description": "Trailing sentences of the previous chunk added for context.",
          "type": "integer",
          "minimum": 0,
          "maximum": 9007199254740991
        },
        "hardBoundaryDepth": {
          "default": 2,
          "description": "Headings at this depth or shallower always start a new chunk (2 = H1 and H2).",
          "type": "integer",
          "minimum": 0,
          "maximum": 6
        },
        "preserveTables": {
          "default": true,
          "description": "Keep tables in their own chunks (split by rows with the header repeated).",
          "type": "boolean"
        },
        "preserveCode": {
          "default": true,
          "description": "Keep code blocks in their own chunks.",
          "type": "boolean"
        },
        "tokenizer": {
          "default": "o200k",
          "description": "\"o200k\" counts real BPE tokens; \"estimate\" is a fast character-based approximation.",
          "type": "string",
          "enum": [
            "o200k",
            "estimate"
          ]
        }
      },
      "additionalProperties": false
    },
    "context": {
      "description": "Contextual retrieval settings.",
      "default": {},
      "type": "object",
      "properties": {
        "strategy": {
          "default": "auto",
          "description": "\"full\" sends the whole document, \"hierarchical\" sends document + section summaries, \"auto\" picks by size.",
          "type": "string",
          "enum": [
            "auto",
            "full",
            "hierarchical"
          ]
        },
        "batchSize": {
          "default": 8,
          "description": "Chunks summarised per request.",
          "type": "integer",
          "minimum": 1,
          "maximum": 50
        },
        "concurrency": {
          "description": "Parallel requests (default: the provider's concurrency).",
          "type": "integer",
          "minimum": 1,
          "maximum": 32
        }
      },
      "additionalProperties": false
    },
    "embedding": {
      "description": "Embedding settings.",
      "default": {},
      "type": "object",
      "properties": {
        "dimensions": {
          "description": "Output dimensions for models that support it (Gemini, OpenAI text-embedding-3, EmbeddingGemma).",
          "type": "integer",
          "exclusiveMinimum": 0,
          "maximum": 9007199254740991
        },
        "batchSize": {
          "description": "Texts per embedding request.",
          "type": "integer",
          "minimum": 1,
          "maximum": 2048
        }
      },
      "additionalProperties": false
    },
    "layout": {
      "description": "Local page layout analysis (PDF).",
      "default": {},
      "type": "object",
      "properties": {
        "engine": {
          "default": "auto",
          "description": "Page layout analysis for PDFs with a local ONNX model (block classes + reading order). \"auto\": on when onnxruntime-node and the downloaded model are present; \"pp-doclayout-v3\": on, downloading the model (130 MB) on first use; \"off\": position heuristics only.",
          "type": "string",
          "enum": [
            "auto",
            "off",
            "pp-doclayout-v3"
          ]
        },
        "minScore": {
          "default": 0.5,
          "description": "Minimum detection confidence.",
          "type": "number",
          "minimum": 0,
          "maximum": 1
        },
        "render": {
          "default": 1024,
          "description": "Longer page side, in pixels, of the render the model sees.",
          "type": "integer",
          "minimum": 512,
          "maximum": 2048
        }
      },
      "additionalProperties": false
    },
    "figures": {
      "description": "Figure extraction (PDF, images).",
      "default": {},
      "type": "object",
      "properties": {
        "extract": {
          "default": true,
          "description": "Cut the figures of PDF pages and images (embedded pictures; with layout analysis also charts and drawings) out as PNG files under figures/ and reference them from the markdown.",
          "type": "boolean"
        },
        "describe": {
          "default": false,
          "description": "Have models.vision describe every extracted figure (two to five sentences stored under the image, for retrieval). One vision request per figure.",
          "type": "boolean"
        },
        "minSize": {
          "default": 0.015,
          "description": "Smallest figure kept, as a share of the page area; icons and logos fall below it.",
          "type": "number",
          "minimum": 0,
          "maximum": 1
        }
      },
      "additionalProperties": false
    },
    "rerank": {
      "description": "Reranking of search results (eval, mcp).",
      "default": {},
      "type": "object",
      "properties": {
        "engine": {
          "default": "auto",
          "description": "Reranker that reorders the top search candidates (eval, mcp). \"auto\": the local mmarco-minilm when onnxruntime-node and the model are present; a local model id, downloaded on first use (mmarco-minilm 120 MB, 14 languages + transfer; bge-reranker-base 280 MB; bge-reranker-v2-m3 570 MB, 100+ languages, slow on CPU); a hosted one as \"provider/model\" (cohere/rerank-v3.5 with COHERE_API_KEY, jina/jina-reranker-v2-base-multilingual with JINA_API_KEY); \"off\".",
          "type": "string"
        },
        "candidates": {
          "default": 30,
          "description": "First-stage results (hybrid or BM25) handed to the reranker.",
          "type": "integer",
          "minimum": 5,
          "maximum": 200
        }
      },
      "additionalProperties": false
    },
    "cache": {
      "description": "On-disk cache.",
      "default": {},
      "type": "object",
      "properties": {
        "enabled": {
          "default": true,
          "description": "Cache OCR pages, summaries and embeddings so reruns are free and resumable.",
          "type": "boolean"
        },
        "dir": {
          "description": "Cache folder (default ~/.rag-chunker/cache).",
          "type": "string",
          "minLength": 1
        }
      },
      "additionalProperties": false
    }
  },
  "additionalProperties": false,
  "$id": "https://unpkg.com/@msbayindir/rag-chunker@4/schema/config.schema.json",
  "title": "rag-chunker configuration"
}
